In which region are Fitou AC wines produced?,Languedoc-Roussillon,"Pinot Blanc, Sylvaner, Pinot Noir","Pinot Blanc, Sylvaner, Pinot Noir",16.4% for Riesling and Muscat; 18.2% for Pinot Gris and Gewurztraminer
In which region are Corbieres AC wines produced?,Languedoc-Roussillon,The Vosges,The Vosges,"Pinot Blanc, Sylvaner, Pinot Noir"
In which region are Minervois AC wines produced?,Languedoc-Roussillon,100%,100%,The Vosges
In which region are Bandol AC wines produced?,Provence,The Loire Valley,The Loire Valley,100%
Which grape is predominant in the production of Bandol AC wines?,Mourvedre,The Loire Valley,The Loire Valley,The Loire Valley
In which region is Faugeres?,Languedoc-Roussillon,The Loire Valley,The Loire Valley,The Loire Valley
In which region is Saint Chinian?,Languedoc-Roussillon,Sauvignon Blanc,Sauvignon Blanc,The Loire Valley
What is the German expression for a wine from a single vineyard?,Einzellage,"Sauvignon Blanc, Pinot Noir","Sauvignon Blanc, Pinot Noir",Sauvignon Blanc
What is the German expression for a group of adjoining vineyards?,Grosslage,"Sauvignon Blanc, Chenin Blanc","Riesling, Muscat, Gewurztraminer, Pinot Gris","Sauvignon Blanc, Pinot Noir"
What is the German expression for a wine producing commune?,Gemeinde,"Gamay, Cabernet Franc",Vendange Tardive (VT) and Selection de Grains Nobles (SGN),"Riesling, Muscat, Gewurztraminer, Pinot Gris"
"What is the German expression for a district within a Quality region, consisting of several communes?",Bereich,Cabernet Franc,14% for Riesling and Muscat; 15.3% for Pinot Gris and Gewurztraminer,Vendange Tardive (VT) and Selection de Grains Nobles (SGN)
What is the German expression for a designated quality region?,Anbaugebiet,Cabernet Franc,16.4% for Riesling and Muscat; 18.2% for Pinot Gris and Gewurztraminer,14% for Riesling and Muscat; 15.3% for Pinot Gris and Gewurztraminer
"What proportion of wine must come from the specified source if a German wine us labelled Bereich, Grosslage or Einzellage?",85%,Chenin Blanc & Cabernet Franc,"Pinot Blanc, Sylvaner, Pinot Noir",16.4% for Riesling and Muscat; 18.2% for Pinot Gris and Gewurztraminer
What is the German word for dry (in relation to wine)?,Trocken,The Loire Valley,The Vosges,"Pinot Blanc, Sylvaner, Pinot Noir"
What is the German expression for off-dry?,Halbtrocken,The Loire Valley,100%,The Vosges
"What does the German expression ""Classic"" mean when referring to a wine?","Harmoniously dry, with a minimum alcohol level of 12% (11.5% in Mosel); must be from a single grape variety frmo a single vintage in a single region",The Loire Valley,The Loire Valley,100%
In which 4 regions can Liebfraumilch be produced?,"Rheinhessen, Pfalz, Rheingau, Nahe",The Loire Valley,The Loire Valley,The Loire Valley
Which is the most widely planted grape in Germany?,Riesling,Chenin Blanc,The Loire Valley,The Loire Valley
What is the German expression for unfermented grape juice?,Sussreserve,Chenin Blanc,Sauvignon Blanc,The Loire Valley
Piesport is in which German wine-growing region?,"Mosel, Germany","Chenin Blanc, Cabernet Franc, Grolleau, Gamay","Sauvignon Blanc, Pinot Noir",Sauvignon Blanc
Bernkastel wine is made in which region?,"Mosel, Germany",Muscadet,"Riesling, Muscat, Gewurztraminer, Pinot Gris","Sauvignon Blanc, Pinot Noir"
Brauneberg wine is made in which region?,"Mosel, Germany",,,
Wehlen wine is made in which region?,"Mosel, Germany",Einzellage,"Sauvignon Blanc, Pinot Noir","Sauvignon Blanc, Pinot Noir"
Graach wine is made in which region?,"Mosel, Germany",Grosslage,"Sauvignon Blanc, Chenin Blanc","Riesling, Muscat, Gewurztraminer, Pinot Gris"
Erden wine is madein which region?,"Mosel, Germany",Gemeinde,"Gamay, Cabernet Franc",Vendange Tardive (VT) and Selection de Grains Nobles (SGN)
Schlossbockelheim wine is made in which region?,"Nahe, Germany",Bereich,Cabernet Franc,14% for Riesling and Muscat; 15.3% for Pinot Gris and Gewurztraminer
Johannisberg is in which wine region?,"Rheingau, Germany",Anbaugebiet,Cabernet Franc,16.4% for Riesling and Muscat; 18.2% for Pinot Gris and Gewurztraminer
Bad Kreuznach is in which wine growing region?,"Nahe, Germany",85%,Chenin Blanc & Cabernet Franc,"Pinot Blanc, Sylvaner, Pinot Noir"
Rudesheim is in which wine growing region?,"Rheingau, Germany",Trocken,The Loire Valley,The Vosges
Geisenheim is in which wine growing region?,"Rheingau, Germany",Halbtrocken,The Loire Valley,100%
Winkel is in which wine growing region?,"Rheingau, Germany","Harmoniously dry, with a minimum alcohol level of 12% (11.5% in Mosel); must be from a single grape variety frmo a single vintage in a single region",The Loire Valley,The Loire Valley
Oestrich is a village in which German wine region?,Rheingau,"Rheinhessen, Pfalz, Rheingau, Nahe",The Loire Valley,The Loire Valley
Eltville is in which wine growing region?,"Rheingau, Germany",Riesling,Chenin Blanc,The Loire Valley
Nierstein is in which wine growing region?,"Rheinhessen, Germany",Sussreserve,Chenin Blanc,Sauvignon Blanc
Which German wine region has the greatest area under vine?,Rheinhessen,"Mosel, Germany","Chenin Blanc, Cabernet Franc, Grolleau, Gamay","Sauvignon Blanc, Pinot Noir"
Kaiserstuhl Spatburgunder wines are made in which region?,"Baden, Germany","Mosel, Germany",Muscadet,"Riesling, Muscat, Gewurztraminer, Pinot Gris"
Kaiserstuhl Spatburgunder wines are predominantly made from which grape?,Pinot Noir,"Harmoniously dry, with a minimum alcohol level of 12% (11.5% in Mosel); must be from a single grape variety frmo a single vintage in a single region",The Loire Valley,The Loire Valley
Forst is in which wine growing region?,"Pfalz, Germany","Harmoniously dry, with a minimum alcohol level of 12% (11.5% in Mosel); must be from a single grape variety frmo a single vintage in a single region",The Loire Valley,The Loire Valley